id,cleaned_description
944,company description prescriptive data creator nantum os awardwinning platform optimizing buildings operational performance saving energy reducing carbon emissions lowering costs without sacrificing occupant health comfort combining historical data predictive analysis realtime occupancy nantum os enables buildings hit esg goals via actionable insights job description software engineer backend team prescriptive data play crucial role development maintenance various apis integrations backend services work closely engineering teams product managers deliver highquality scalable software solutions exciting opportunity individual 23 years development experience looking learn wealth experience already place team also significant role delivering code within startup environment responsibilities work members backend team design implement scalable solutions fit product goals develop test maintain highquality code capable evolving organization grows collaborate engineering teams product managers design next generation software contribute existing backend services integrations helping implement new solutions required assist diagnosis troubleshooting production issues help expand monitoring response capabilities needed participate code reviews provide constructive feedback maintain code quality stay uptodate industry trends contribute continuous improvement development process skills abilities 23 years professional development experience strong proficiency javascripttypescript experience nodejs familiarity nosql eg mongodb sql eg postgresql databases understanding restful api design principles knowledge version control systems git excellent problemsolving communication skills enthusiastic working collaborative startup environment
943,uniswap protocol largest decentralized trading automated market making protocol often called dex decentralized exchange ethereum uniswap labs team major contributor uniswap protocol focuses building suite products support uniswap labs ecosystem team one impactful crypto headquartered soho new york city option partially fully remote depending position looking junior engineer help us build next generation uniswap protocol responsible designing implementing systems protocols build upon ethereum blockchain responsibilities build maintain low level backend services interact uniswap protocol research contribute ethereum improvement proposals eips participate discussions initial product ideas launch requirements 1 years experience working blockchains consensus algorithms p2p applied cryptography deep knowledge ethereum evm broad understanding ethereum roadmap understanding different blockchain designs tradeoffs cryptography underpinning blockchains strong understanding distributed systems computer science fundamentals fluency typescript go rust similar language nice experience cloud infrastructure networking orchestration aws eg docker ecs cdk dynamodb experience writing smart contracts love unicorns minimum fulltime salary 180000210000
942,bebop decentralized trading platform aims deliver stepchange user experience trading defi believe defi future finance facilitating true innovation economic freedom ability create best financial products bebop mission make superior trading products efficient execution available anyone driven best practices user experience usercentric design heart everything making products fun easy use work relentlessly leverage deepest expertise become leader industry bebop born incubated wintermute one largest trading companies crypto leading liquidity powerhouse defi learn bebop bebopxyz twitter discord medium working bebop bebop opportunity grow professionally make direct impact business frontend engineer work closely design product engineering teams focus bringing life carefully designed web interfaces across desktop mobile requirements must absolutely love implementing beautiful pixelperfect interfaces using design libraries animations transitions etc deep understanding interaction design design implementation youve accumulated experience building design prototypes taking final product experience possess good knowledge modern web development tools techniques react typescript html5 css3 styled components etc experience web3 plus mandatory
941,anima automates frontend development using ai anima allows rd teams run 2x faster build robust products focus creativity anima anima team designers developers product managers visionary team united common purpose world explaining ideas feel like eternity decided change way design code happens founded 2017 proudly backed ycombinator anima stands pioneer designtocode field changing creativity works leading transformation anima proudly ranks 1 figma plugin development category 600000 installs coding pioneers 2022 anima generated code equivalent 15 million coding hours propelling us future empowering creators globally 2022 alone anima fueled creation 10000 websites welcomed 40 million visitors join us reshaping world design development challenges work develop backend api using pythonflask mongodb aws develop javascript node react solutions various design tools develop backend microservices participate design discussions product manager domain experts assess feasibility new products features help refine establish new development guidelines policies analyze troubleshoot complex problems timely accurate manner skills knowledge possess 5 years experience across stack python node extensive experience frontend performance tuning strong portfolio public code github bitbucket etc focused maximizing impact team anima whole comfortable ambiguity enjoy figuring needs doneand
940,description work closely artists designers understand define game features system requirements implement test debug maintain source code deliver high quality functional systems specification collaborate engineers develop iterate game features provide ongoing support artists designers make educated tradeoffs among scope quality pace requirements strong programming skills deep knowledge algorithms data structures working towards degree computer science similar discipline physics math ee etc excellent written oral communication skills english preference applicants experience developing software professional environment developing software using agile methodologies developing games unreal andor unity game engines working c andor c developing apps games mobile platforms
939,weve scaled 50k monthlyactive users processing millions nft transactions per week 2 founders looking bring first founding engineers youll ground floor scaling tensor next 1 million traders building sophisticated trading infrastructure platform nfts world ship new products nft traders faster data capital efficiency advanced order types optimize scale data pipelines handle o110k transactionssecond peak projects endtoend frontend backend apis data pipelines onchain smart contracts work solanas stateoftheart fastestincrypto virtual machine write smart contracts rust excited web3cryptonfts really cannot overstate youll joining team web3 nerds generalist 3 years experience working largescale dataintensive apps experienced react nodejs postgres redis docker experience modern stacks thats totally fine long youre fast learner proficient least one lowlevel language ideally rust go
938,working block one enjoyable fulfilling challenging experiences youll career block leading research analysis news brand digital asset space founded 2018 based nyc blocks team spread across 7 times zones covering global cryptocurrency blockchain space 247 blocks website newsletter genesis research brand podcast scoop hosted 3rd party events community participation interact daily tens thousands crypto natives financial market participants fortune 500 professionals global service providers government leaders block delivers deep insight emerging sector interacts traditional finance technology governments markets blocks foundation simple first final word digital assets job description block research looking passionate individual join 25person research team research intern produce unique insights digital assets industry institutions corporate executives around world rely onyou work directly research teams responsible delivering custom research projects clients blocks professional services team works directly blocks clients variety special projects ranging investment diligence asset diligence product gtm strategy market update briefings thought leadership custom data pulls member lean team opportunity make direct impact strategic decisions well regarded firms crypto traditional finance techhaving access full spectrum digital asset data providers internal frameworks able utilize analytical skills produce highly demanded stateoftheart insights moreover leveraging strong industry network expand existing knowledge base opportunity build personal brand social media eventsthis role offers competitive compensation significant opportunities advancement
936,headlight founded 2005 delivers industryleading technology solutions revolutionized infrastructure construction industry photodriven inspection verification technology enables customers streamline mobilize project inspections communications documentation leading superior project deliveries variety customers ranging state departments transportation toptier engineering firms contractors equipment manufacturers industryrelated materials companies opportunities shape provide efficiencies infrastructure construction industry endless come join headlight team software engineer get bring passion software help develop features solutions within product suite work talented team expand reach infrastructure construction space building innovative platform reducing customers budget time risk collaborate engineers programproduct managers test engineers deliver critical applications improve upon headlights existing platform
934,meet team seeking people passionate making difference world torc growing assembling teams creative ambitious people tenacity make impossible possible join us make roads workplaces missions safer everyone culture one openness transparency work reflects torcrs encouraged bring forward new ideas initiatives matter job working youll able directly observe contribution comes life solutions create together youll looking engineering professionals expertlevel skills software development automation combined experience working area developer enablement bring new ideas optimizations best practices entire software organization software engineer focused tool development automation apply work remotely torc robotics
931,revolutionizing technical hiring giving companies skillsbased hiring platform enables customers assess technical skills effectively growing fast looking add engineering team position fulltime based remotely within india frontend engineer play pivotal part hackerranks mission accelerate worlds innovation excited make impact lives millions developers build platform showcase skills get hired responsible building worlds leading technical interview platform believe extreme ownership youll immense ownership terms product engineering work directly impact lives millions developers build platform showcase skills get hired responsible building systems back screen interviews pro apply work remotely hackerrank
922,company overview casetext part thomson reuters fastgrowing legal technology company tackling 6 billion us legal research market advancing cause justice empowering attorneys provide highquality efficient affordable representation clients award winning research platform helps millions users access understand law every month aipowered search tools cutting edge search technology role casetext seeking backend engineer help grow cocounsel state art ai legal assistant backend engineer youll expand capabilities chat service userfacing llmpowered hub understands routes cocounsels skills youll collaborate skills teams identify implementation patterns developer pain points address improvements skill framework ideal candidate curious sympathetic keen eye simp apply work remotely casetext part thomson reuters
924,fathom mission use ai understand structure worlds medical data starting making sense terabytes clinician notes contained within electronic health records worlds largest health systems deep learning engine automates translation patient records billing codes used healthcare provider reimbursement process today costs hospitals us 15b annually tens billions errors denied claims venturebacked company completed series b round financing 46m late 2022 passionate machine learning looking opportunity make impact healthcare seeking extraordinary senior software engineer machine learning based remotely north america design machinebased systems also think creatively human interactions necessary augment train systems want work teammates apply work remotely fathom
920,lucidworks leading digital transformation worlds biggest retailers financial services firms manufacturers b2b commerce organizations believe core great digital experience starts search browse deep learning technology captures user behavior utilizes machine learning connect people products content information need brands including crate barrel lenovo red hat cisco systems rely lucidworks suite products power commerce customer service workplace applications delight customers empower employees lucidworks believes power diversity inclusion help us best work equal opportunity employer welcome talent across full range backgrounds orientation origin identity inclusive nondiscriminatory way role searching creative passionate individual technical success engineerin apply work remotely lucidworks
916,acquia open digital experience company provide worlds ambitious brands products built around drupal allow embrace innovation create customer moments matter acquia believe power community collaboration giving customers partners freedom build tomorrow terms headquartered us named one north americas fastest growing software companies deloitte inc magazine rated leader analyst community named one best places work india great place work acquia building future want part acquia seeking software engineer skills pythonruby go kubernetes knowledge jenkins cicd docker help lead efforts developing maintaining monitoring securing tooling software engineer working sre tooling development apply work remotely acquia
901,building future crypto krakenites worldclass team crypto conviction united desire discover unlock potential crypto blockchain technology makes us different kraken missionfocused company rooted crypto values krakenite youll join us mission accelerate global adoption crypto everyone achieve financial freedom inclusion decade krakens focus mission crypto ethos attracted many talented crypto experts world apply please read kraken culture page learn internal culture values mission fully remote company krakenites 60 countries speak 50 languages krakenites industry pioneers develop premium crypto products experienced traders institutions newcomers space kraken committed industryleading security crypto education worl apply work remotely kraken
900,looking smart contract developer capable self sufficient self motivating self starter heart must experience solidity development blockchain space smartcontract andor web3 interactions ideally nft gaming problem solving best nothing impossible matter figuring team player possessing strong analytical well technical skills must comfortable working agile environment ability take wheel necessary requirements immersed blockchain technologies interested game development nfts lead smart contract development estimate scope smart contract developement write test code ensure compatibility stability refine rewrite necessary execute full software development life cycle sdlc integrate software compone apply work remotely gamefi
898,spruce builds digital versions identification like mobile drivers licenses offer security privacy protection control individuals across digital interactions credible product fostering three pillars technology privacyenhancing interoperable open source site reliability engineer serve bridge development customer operations teams enabling development team bring new software new features production quickly possible also ensuring agreedupon acceptable level operations performance error risk line customer service level agreements individual actively diagnose manage deployment issues well develop automation mitigation systems improve future deployments individual focused customers pacific time zone working hours reflect focus wellworn paths theoreticals every spruce apply work remotely spruce
895,spruce reimagining trusted interactions creating worlds best software packaging beliefs digitally team programmers working develop worldclass open source products libraries implementing open global standards identity wellworn paths theoreticals every spruce technical staffer gets hands dirty writing code learning new technologies solving problems bleeding edge space hire resultsoriented developers love technology committed intellectual honesty user privacy innovation ideal candidate mobile engineering role experience bringing endtoend mobile applications zero one android work credential wallet allows end users control digital identity keeping privacy across product lines use combination core identity libraries cuttingedge cryptography new interoperable identity apply work remotely spruce
888,company summary bugcrowd worlds 1 crowdsourced security company awardwinning platform combines actionable contextual intelligence skill experience worlds elite hackers help leading organizations solve security challenges protect customers make digitally connected world safer place job summary bugcrowd handle application security assessments epic scale application security engineer ase curate manage incoming security vulnerability submissions worlds biggest companies bug bounty programs ase responsible ongoing triage validation services bugcrowd managed programs direction director security operations take incoming submission data curate validity accuracy severity well communicate directly bugcrowds clients researchers additional information required ases also apply work remotely bugcrowd
890,us openhedge venture studio working web3 financial infrastructure partner ambitious protocols space support hands build together openhedge mainly focused market microstructure research design implementation specialty designing new market mechanisms possible distributed open ledgers role working alongside openhedge team various projects develop solidity smart contracts based project mechanisms write tests covering solidity contracts write review code various applications liaise designers decide uiux elements define new standards smart contract integrations expected mentor team members refine technical architectural skills expect team management task assignment organiza apply work remotely openhedge
875,glean mission make knowledge work faster humane believe ai fundamentally transform people work future everyone work tandem expert ai assistants find knowledge create synthesize information execute work assistants free people focus higherlevel creative aspects work building system intelligence every company world surface think google chatgpt enterprise hood platform connective tissue ai knowledge brings companys knowledge together understands deep level provides industryleading search relevance connects generative ai agents applications glean founded seasoned team former google search facebook engineers saw need enterprise space technical depth passion ai apply work remotely glean
873,pay range 100000 116968 annual compensation job posting closing wednesday december 13 2023 signon incentive 5400 workdays hours monday friday 8am 5pm eveningweekend work required hybrid work arrangements may available two days per week remote completing initial sixmonth probationary period benefits position include 11 paid holidays medical dental vision paid time pension plan professional development opportunities much city fort worth one fastest growing large cities us employees serve needs nearly 1000000 residents promoting values exceptional customer experience mutual respect embracing diversity continuous improvement ethical behavior accountability sr civil engineer mobility infrastructure position available city fort worth transportation public works depa apply work remotely city fort worth
872,flywheel flywheels suite digital commerce solutions accelerate growth across major digital marketplaces worlds leading brands give clients access near realtime performance measurement improve sales share profit teams across americas europe apac china offer career real impact endless growth opportunities support need best opportunity looking midsenior data engineer join team best candidates hit ground running contribute data team develop maintain necessary data automation reports etlelt quality controls using leadingedge cloud technologies deep knowledge understanding stages software development life cycle ability selfstart mentor manage less experienced data engineers desire learn new technology manage multiple priorities stro apply work remotely flywheel
871,deliveroo building definitive online food company transforming way world eats making hyperlocal food convenient accessible obsess building future food whilst using network force good forefront industry powered marketleading technology unrivalled network bring incredible convenience selection customers working deliveroo perfect environment build definitive career motivated impact firstly impact working development allowing grow faster might elsewhere secondly impact deliveroo leaving mark scale finally part something bigger impact make together marketplace communities team deliveroo striving build industrys best engineering organisation teams solving unique difficult p apply work remotely deliveroo
874,hightouch hightouchs mission empower everyone take action data reverse etl platform business data users seamlessly sync data resides warehouses databases needed including operational systems saas tools traditionally acting data required engineering time bandwidth left business users stuck charts reports unable take automated action data hightouch every business user without writing code activate data streamline critical processes improve marketing performance scale operations team operates focus making meaningful impact customers believe approaching challenges first principles thinking mindset moving quickly embracing value efficient execution treating compassion kindness look team members strong com apply work remotely hightouch
869,offchain labs developed suite scaling solutions ethereum includes arbitrum optimistic rollup instantly scales apps reducing costs increasing capacity without sacrificing ethereums security porting contracts arbitrum requires code changes downloads since compatible existing ethereum developer languages tooling arbitrum today leading ethereum scaling solution dominant market share including hundreds apps platform 50 rollup liquidity team extremely passionate works tirelessly bridge gap blockchain blockchain strive maintain atmosphere fosters innovation new ideas collaboration research deep discussions raising initial round 38m seed funding january 2019 20m series well 100m series b 2021 ready hire additional team members interest worki apply work remotely offchain labs
870,cardata goal provide costeffective accurate ways reimburse drivers using personal vehicles work partner closely customers provide bestinclass support service technology drive matters employees recently secured investment 100m fuel vision building complete vehicle management platform read seeking dedicated mobile developer react native specific join new cardata mobile team collaborate part team developers work creating maintaining cardata mobile applications main react native developer need familiar react native ecosystem mobile app development including familiarity popular app frameworks software development best practices responsible maintaining existing codebases including bug fixing following coding guide apply work remotely cardata
864,imagine opengov mission driven fastgrowth series venture backed startup includes andreessen horowitz formation 8 cox emerson collective board directors includes iconic silicon valley executives john chambers former cisco chairman ceo marc andreessen time magazines list 100 influential people world opengov leader modern cloud software local governments state agencies surpassed 1800 governments growing fast using products mission power effective accountable government opengov 2023 top workplaces usa award winner forbes 2022 americas best startup employer job summary opengov leader modern cloud software cities counties state agencies school districts special districts mission power effective accountable government opengov serves thousands public sector leaders apply work remotely opengov
868,company overview fanatics building leading global digital sports platform company ignites passions global sports fans maximizes presence reach hundreds sports partners globally offering innovative products services across fanatics commerce fanatics collectibles fanatics betting gaming allowing sports fans buy collect bet fanatics platform sports fans buy licensed fan gear jerseys lifestyle streetwear products headwear hardgoods collect physical digital trading cards sports memorabilia digital assets bet company builds sportsbook igaming platform fanatics established database 100 million global sports fans global partner network 900 sports properties including major national international professional sports leagues teams players associations athletes celebrities colleges apply work remotely fanatics
