id,cleaned_description
2416,job description join bonfire fuel passions creators brands offering cuttingedge nocode tools transform followers vibrant communities leveraging digital assets bespoke content exclusive events enable web3enhanced space creators truly dedicated empowering innovators harness full creative financial potential inherent community working emerging rapidly evolving domain value creator obsession putting needs creators first diversity celebrating plurality perspectives transparent communication fostering openness kindness efficient execution prioritizing speed unity continuous learning embracing growth adaptability tech stack includes modern tools like nextjs vercel prisma orm postgres clientside power react graphql typescript ideal candidate scouting owners committed exceptional code developer experience explorers keen crafting refining products dynamic market fast learners able navigate uncertainty adopt new tech swiftly design enthusiasts collaborate tightly product design teams recommended qualifications proficiency nodejs react graphql web3 minimum 3 years developing consumer internet applications benefits competitive salaries equity work dedication rewarded salary matches skills experience plus stake success health insurance comprehensive medical dental vision plans workfromhome stipend get premium remote setup including laptop headphones gear require conference participation stipend attend leading web3 conferences events flexible hours enjoy remotefirst environment adaptable working hours unlimited vacation liberally take time need genuinely support worklife balance
2414,would like come work us cannot find next career opportunityplease feel free send us open application submit application application form contact soon possible
2122,building omni platform allowing developers deploy applications across rollups without fragmenting liquidity looking early team members help us bring ambitious vision life team already built platform processed 70m leading 18m fundraise top investors including pantera two sigma ventures coinbase ventures alongside angel investors including stani kulechov founder aave sandeep nailwal cofounder polygon addition recent testnet onboarded 300000 users less two months growing rapidly need ambitious experienced team members join us help scale ethereums future role engineers join team role responsible designing implementing foundational components omni stack involves working heavily golang tendermint eigenlayer interoperability components offchain servi apply work remotely omni network
2123,nexus mutual onchain risk marketplace operated members mission build ecosystem anyone protect anyone else sharing risk mutual launched 2019 become leading coverage provider within defi ecosystem 73m claims paid date protocol provides decentralized transparent alternative traditional insurance companies economic incentives within mutual solve centralized insurance industrys core problem principalagent problem looking looking frontend engineer work us build premier onchain risk marketplace defi cefi beyond learn us twitter discord github someone work end end help us build deploy intuitive user interfaces span web pages applications team working web3 technologies across stack ideal person apply work remotely nexus mutual
2121,xmtp inc cofounded matt galligan shane mac headquartered web mission xmtp labs build secure open decentralized communication protocol connects creators communities apps users set design modern organization startone thats global remote asynchronousbydefault backed best investors tech crypto a16z crypto offline ventures sound ventures distributed global redpoint ideo colab many key ecosystem investors operators see full list experience 5 years experience building distributed software systems substantial exposure cryptographic protocols blockchain technologies demonstrable experience designing building operating cryptobased decentralized systems capability identify comprehend integrate tradeoffs handson experience building various protocols apply work remotely xmtp
2062,mission increase success rate small businesses traditional banking growth limiter rather growth enabler business owners changing relay allinone collaborative money management platform building employer smbs finance function internal external focused delivering humancentric customer experience ultimately help smbs money looking incredible senior site reliability engineer join trust team love making highimpact decisions daily desire help shape future relay going crucial teams vision protecting cathedral enabling bazaar quite challenge scope multiple environments please note consider applicants based eastern time zone based greater toronto area hybrid work environment choose apply work remotely relay financial
2058,success reliant building teams include people different backgrounds experiences elevate assumptions ideas fresh perspectives dedicated hiring whole human resume end look diverse pool applicantsincluding historically marginalized groups would like invite apply even dont think meet requirements listed dont want lines job description get us opportunity meet team record management team leads experience viewing creating sales records people accounts opportunities etc heavily interacted pages within outreach teams primary mission help reps browse wealth data well help customer extend outreach data model according needs role expanding existing team looking additional expe apply work remotely outreach
2037,join us senior support engineer clients count top talents customers big players different industries need solutions problems support team responsible providing technical solution aiming greatest customer satisfaction senior support engineer lead work technical support engineers cases help cultivate team values technical expertise position suits written spoken english advanced level strong experience technical role industry highly technical environment preferred great explaining complex issues simple manner experience creating updating sharing knowledge articles training problemsolving mindset help remove roadblocks set high standards team continuous lear apply work remotely ecore
2025,nexus mutual onchain risk marketplace operated members mission build ecosystem anyone protect anyone else sharing risk mutual launched 2019 become leading coverage provider within defi ecosystem 73m claims paid date protocol provides decentralized transparent alternative traditional insurance companies economic incentives within mutual solve centralized insurance industrys core problem principalagent problem looking looking smart contract engineer help us build premier onchain risk marketplace defi cefi beyond learn us twitter discord github someone write deploy complex smart contract logic team player work alongside group designing implementing product functionalities core mechanisms power nexus apply work remotely nexus mutual
2014,blueocean different kind saas company team problem solvers fueled challenging convention looking doers leaders dreamers join us venturebacked arguably best saas vc world insight partners looking hire want join us build ship mission revolutionize marketing decisions made single pane glass connecting data insights actions outcomes fundamental vision simply unlock human creativity critical thinker selfmotivated intellectually curious adventurous need figure things work highly focused determined youre standout colleague strong leadership qualities wellrespected peers driven making impact code love working cool projects latest technologies motivated innovation like c apply work remotely blueocean ai
2007,upkeep leading cloudbased asset operations management software developed revolutionize way teams manage facilities maintenance work provide mobilefirst saas solutions industrial iot sensors data analytics tools advanced enterprise integrations topnotch professional services innovative technology modernizing workflows maximizing operational efficiency 3000 customers including shell yamaha unilever mcdonalds subway pepsi marriott series b tech startup 100 team members across us weve recognized best place work multiple years row fostering inclusive missiondriven culture addition stock options great benefits people flexibility work remote upkeep ranked 1 facility management software gartner 1 maintenance management software g2 crowd frontrunners software advice cmms leader idc marketscape apply work remotely upkeep
1979,believe way people interact finances drastically improve next years dedicated empowering transformation building tools experiences thousands developers use create products plaid powers tools millions people rely live healthier financial life work thousands companies like venmo sofi several fortune 500 many largest banks make easy people connect financial accounts apps services want use plaids network covers 12000 financial institutions across us canada uk europe founded 2013 company headquartered san francisco offices new york washington dc london amsterdam liremote mission plaids product security team improve customers trust assuring secure development delivery products services minimizing risk ecosystem apply work remotely plaid
1978,degreed india engineering looking experienced full stack engineer excited designing implementing scalable solutions join team position work collaboratively engineers implement reliable robust scalable solutions exercise judgment determining recommending best solution based business requirements timelines resource constraints value individuals lifelong learners passionate taking new challenges continuous improvement mindset role based onsite bengaluru india inoffice onboarding period incumbents expected available office days per week part hybrid work model candidates also required travel internationally 12 times annually full company gatherings day life deliver endtoend implementation new userfacing features andor enhanceme apply work remotely degreed
1971,youll looking talented intensely curious senior aws cloud engineer nimble focused startup mentality newly created role liaison data engineers data scientists analytics engineers work create cuttingedge architecture provides increased performance scalability concurrency data science analytics workflows responsibilities provide aws infrastructure support systems administration support new existing products implemented thru iam ec2 s3 aws networking vpc igw ngw alb nlb etc terraform cloud formation templates security security groups guard duty cloud trail config waf monitor maintain production development qa cloud infrastructure resources compliance six pillars aws wellarchitected framework including security pilar develop maintain continuous integrati apply work remotely spotter
1963,zooxs hardware software integration team responsible ensuring various hardware subsystems work reliably vehicle platform daytoday basis hardware software integration engineer oversee deployment nextgeneration compute sensor data networking systems autonomous vehicles role essential fundamental execution stage zooxs vehicle program ensuring hardware systems operate predictably times team first line defense issues vehicle fleet looking someone excellent communication skills excited first responder triage debug difficult hwsw integration issues team also responsible supporting bringup manufacturing operations vehicle responsibilities assist hardware software integration team supporting various autonomous vehicle platforms provide remote support auton apply work remotely zoox
1962,opportunity connector operations teams mission ensure airbytes catalog 300 connectors easy work manage connector developers airbyte users includes overall monitoring quality performance connectors along process build test monitor publish certify also ensure connectors pleasure discover install upgrade within airbyte product building app store airbyte connectors getting connector management right breadandbutter airbyte success looks like evergrowing library everyone planet find readytouse connector move data give little importance job titles believe every airbyter know internal level understand whats expected role level opportunity l5 engineer l5s contribute thei apply work remotely airbyte
1961,whatnot whatnot livestream shopping platform marketplace backed andreessen horowitz combinator capitalg building future ecommerce bringing together community shopping entertainment committed values remotefirst team operate hubs within us canada uk germany today innovating fastpaced world live auctions categories including sports fashion video games streetwear platform couples rigorous seller vetting focus community create welcoming space buyers sellers share passions others growing whatnot fastest growing marketplace us past two years hiring forwardthinking problem solvers across functional areas role growth engineers whatnot big ownership velocity order significantly impact company topline metrics achieve apply work remotely whatnot
1918,job description exploring find experienced senior fullstack web developer excellent laravel php jquery css serverside databse work including linux sql mysql senior fullstack web developer managing website development processes expertise essential integrating new web3 technologies building unique robust code ensuring seamless functionality across layers website work frontend backend hiring new developers lead manage workflow responsibilities develop maintain scalable secure web solutions using laravel php relevant technologies enhance frontend usability user experience leveraging expertise html bootstrap css javascriptjquery integrate expand web3 technologies wallet connections smart contract interaction onchain data analytics optimize website performance implementation database optimizations manage backend infrastructure manage optimize server configuration deployment maintenance ensure smooth reliable performance scalability operation lead manage team developers providing guidance mentorship technical expertise support team troubleshooting issues finding innovative solutions conduct code reviews ensure coding best practices contribute improving development processes standards stay updated latest trends advancements web development web3 technologies sharing knowledge team research competitors industry trends identify opportunities adopt collaborate crossfunctional teams including graphic designer content creation marketing sales qualifications strong experience fullstack web developer excellent laravel php serverside database work great understanding frontend technologies including html bootstrap css javascript experienced web3 technologies integration web3 wallets smart contracts practice database design optimization management expertise sql related technologies experienced serverside technologies practiced working linuxbased server environments practice server configuration deployment management tools eg nginx skilled server performance optimization techniques scalability principles familiar security best practices fields practice ai integration workflow enhance efficiency productivity chatgpt experience leading managing team developers fostering collaboration delivering highquality results strong problemsolving skills ability work effectively fastpaced agile development environment excellent communication teamwork skills ability effectively collaborate crossfunctional teams practiced version control systems eg git agile development methodologies experience devops practices deployment tools plus familiarity graphic design principles tools plus benefits salary payment possible crypto team airdrop allocation upcoming p2e token software licenses training programs part shaping whole web3 industry working global remote team highly skilled passionate colleagues flexible working hours teamwork culture apply senior fullstack web developer passion web3 technologies want hear please submit resume along cover lettermessage outlining relevant experience interested joining playtoearn shortlisted candidates contacted join us driving web3 gaming industry lead developments stateoftheart
1915,bebop bebop decentralized trading platform aims deliver stepchange user experience trading defi believe defi future finance facilitating true innovation economic freedom ability create best financial products bebop mission make superior trading products efficient execution available anyone driven best practices user experience usercentric design heart everything making products fun easy use work relentlessly leverage deepest expertise become leader industry bebop born incubated wintermute one largest trading companies crypto leading liquidity powerhouse defi learn bebop bebopxyz twitter discord medium working bebop bebop opportunity grow professionally make direct impact th apply work remotely bebop
1914,like work nearsure remote team never felt close join latam team stay connected working remotely value team members candidates interested vacancies enjoy fun activities like coffee breaks tech talks games developers management teams stay us needs micromanagement us communication key focus working autonomously honesty respecting diversity micromanagement part corporate values worklife balance wellbeing priority people care team available day one offer support help anything needing someone talk requesting time holiday using offered benefits additionally accounts management team ensures smooth effective stay clients fostering harmonious relationship client project youll get apply work remotely nearsure
1910,biorender mission accelerate worlds ability learn discover communicate science passionate democratizing science communication order accelerate scientific discovery understanding looking amazing people help create worlds gotoplace platform science communicated come join us big ambitious goal looking passionate productminded engineers motivated obsessing customer problems building products solve collaborative team environment joining us youll get opportunity collaborate closely product managers designers scientists ship products features equip users necessary tools communicate science faster currently hiring senior staff software engineers growth team growth team aims discover unlock value users focusing different aspects us apply work remotely biorender
1909,sustainlife highenergy earlystage vcbacked climate tech startup focus providing esg solutions customers support ambitions addressing challenging questions time sustainability platform specializes b2b solutions corporate sustainability efforts offering innovative technology solutions industry experience support business targets personal goals vision sustainable future everybody planet mission create bestinclass software changes world looking likeminded individuals join us help us grow building team help users launch sustainability programs benchmark esg performance measure carbon emissions set meaningful goals execute reduction strategies ultimately share progress key stakeholders certified b corporation private certification fo apply work remotely sustainlife
1908,looking senior machine learning engineers work team deliver high quality products efficient way build machine learning services data pipelines automatically extract insights competitors public internal data sources every day services process millions data points including news articles press releases webpage changes slack posts emails reviews crm opportunities user actions utilize broad array ml techniques including classification clustering recommendation summarization prompt engineering vector search retrieval augmented generation klue q klue klue technical perspective klues mission descale huge amounts data human level people process make use klue trusted intermediary right proven sales enablement tomorrow teams enablement apply work remotely klue
1907,trail bits trail bits helps secure worlds targeted organizations products combine highend security research realworld attacker mentality reduce risk fortify code cybersecurity research consulting firm team worked innovative software projects millions people use worldwide help best companies world epic games google microsoft zoom others complex security challenges designing building new technology researching new techniques reviewing security latest available products hit market team considers developing sharing knowledge natural part business push publish every tool project public clients benefit expertise innovations practice thats earned us industry accolades helped contribute doubledigit bottomline gr apply work remotely trail bits
1913,syndica developer infrastructure company building cloud web3 dedicated building developer infrastructure works syndica offers highly scalable rpc node infrastructure advanced logging analytics backed strategic partners investors advisors allin mission chamath social capital coinbase ventures solana ventures many role primary accountability designing implementing operating syndicas blockchain infrastructure platform rust knowledge necessity team operates run write philosophy engineer responsible deploying operating code write successful candidate must demonstrable experience least one programming language preferably go rust c previous work saas application development operations working closely support development team arch apply work remotely syndica
1905,us year people diagnosed cancer autoimmune diseases immune system ultimate determinant health disease however remains black box leveraging aifirst technology want provide highresolution understandings immune system fully unlock power help technology built proven fred hutch ozette creating revolutionary immune profiling platform turn data actionable insights software integral mission enhancing insights 10x volume resolutionscientists clinicians teamswill accelerate breakthroughs drive better patient outcomes ozettes collaborative platform enables unprecedented transparency reproducibility versioncontrolled analysis pipeline built typescript reactrecoiljs backend apis written pythonflask primarily data stored postgresql s3 apply work remotely ozette
1904,xai xais mission create ai systems accurately understand universe aid humanity pursuit knowledge team small highly motivated focused engineering excellence organization appreciate challenging thrive curiosity engineers encouraged work across multiple areas company result engineers researchers share title member technical staff operate flat organizational structure employees expected handson contribute directly companys mission leadership given show initiative consistently deliver excellence work ethic strong prioritization skills important engineers researchers expected strong communication skills able concisely accurately share knowledge teammates xai recruiters every applicati apply work remotely xai
1902,chainsafe leading blockchain research development firm specializing infrastructure solutions decentralized web alongside contributions significant ecosystems ethereum polkadot filecoin mina chainsafe creates solutions developers teams across web3 space utilizing expertise bridging gaming nfts decentralized storage part mission build innovative products users better tooling developers chainsafe embodies opensource communityoriented ethos learn chainsafe look discord github website heres need know reading progressive tech stack includes go rust typescript spearhead ecosystem projects like lodestar web3js forest minars gossamer global remotefriendly open contractors youll form part sygma engineering team bridging protocol sygma apply work remotely chainsafe systems
1901,medialab media technology company focused acquiring growing properties global brands organization unique combination private equity holding company operating entity continue expand proud prominent market position brands come join exceptionally talented team engineers designers product business builders hq located sunny santa monica california growing teams new york across cities us latin america role medialab medialab engineering supports growing number applications across multiple business verticals medialab umbrella engineering team incredibly talented includes talented individuals experience working large scale systems youve designed complex scalable systems built powerful intuitive user interfaces worked great teams hard problems consumer products apply work remotely medialab
1900,highly skilled team software engineers building awesome product moving fast value people take initiatives empower everyone klue make real change product processes looking backend engineers work team deliver high quality products efficient way faq q klue klue technical perspective klues mission descale huge amounts data human level people process make use klue trusted intermediary right proven sales enablement tomorrow teams enablement q level experience looking right looking senior level experienced backend engineers q development team working part backend team concerned data storage retrieval infrastructure enable apply work remotely klue
1903,dept pioneers heart means always leaning forward thinking create tomorrow exist today born digital new model agency deep skillset tech marketing thats hire curious selfdriven talented people never stop innovating culture big enough cope small enough care meaning people across 20 countries big enough provide best tools global opportunities benefits help thrive acting small investing growth team giving autonomy solve clients problems matter world data engineer team data engineering team provides technology solutions architecting developing enterprise systems using variety programming languages tools platforms range building data apply work remotely dept
